{
  "$schema": "https://json-schema.org/draft/2020-12/schema",
  "$id": "https://raw.githubusercontent.com/ls1intum/exgen-bench/main/schemas/protocol/generation-request.schema.json",
  "type": "object",
  "properties": {
    "protocol_version": {
      "type": "string",
      "const": "2"
    },
    "attempt": {
      "type": "object",
      "properties": {
        "id": {
          "type": "string",
          "minLength": 1
        },
        "replicate": {
          "type": "integer",
          "exclusiveMinimum": 0,
          "maximum": 9007199254740991
        },
        "seed": {
          "type": "integer",
          "minimum": 0,
          "maximum": 4294967295
        }
      },
      "required": ["id", "replicate", "seed"],
      "additionalProperties": false
    },
    "case": {
      "type": "object",
      "properties": {
        "id": {
          "type": "string",
          "minLength": 1,
          "maxLength": 128,
          "pattern": "^[a-z0-9][a-z0-9._-]*$"
        },
        "title": {
          "type": "string",
          "minLength": 1
        },
        "brief": {
          "type": "string"
        },
        "tags": {
          "type": "array",
          "items": {
            "type": "string",
            "minLength": 1,
            "maxLength": 128,
            "pattern": "^[a-z0-9][a-z0-9._-]*$"
          }
        }
      },
      "required": ["id", "title", "brief", "tags"],
      "additionalProperties": false
    },
    "target": {
      "type": "object",
      "properties": {
        "id": {
          "type": "string",
          "minLength": 1,
          "maxLength": 128,
          "pattern": "^[a-z0-9][a-z0-9._-]*$"
        },
        "version": {
          "type": "string",
          "minLength": 1
        },
        "revision": {
          "type": "string",
          "minLength": 1
        },
        "parameters": {
          "$ref": "#/$defs/TargetProfile"
        }
      },
      "required": ["id", "version", "revision", "parameters"],
      "additionalProperties": false
    },
    "budget": {
      "type": "object",
      "properties": {
        "wall_time_ms": {
          "type": "integer",
          "exclusiveMinimum": 0,
          "maximum": 9007199254740991
        },
        "max_model_calls": {
          "type": "integer",
          "exclusiveMinimum": 0,
          "maximum": 9007199254740991
        },
        "max_tool_calls": {
          "type": "integer",
          "exclusiveMinimum": 0,
          "maximum": 9007199254740991
        },
        "max_input_tokens": {
          "type": "integer",
          "exclusiveMinimum": 0,
          "maximum": 9007199254740991
        },
        "max_output_tokens": {
          "type": "integer",
          "exclusiveMinimum": 0,
          "maximum": 9007199254740991
        },
        "max_total_tokens": {
          "type": "integer",
          "exclusiveMinimum": 0,
          "maximum": 9007199254740991
        },
        "max_cost": {
          "$ref": "#/$defs/CostLimit"
        },
        "enforcement": {
          "default": {},
          "type": "object",
          "propertyNames": {
            "type": "string",
            "enum": [
              "wall_time_ms",
              "model_calls",
              "tool_calls",
              "input_tokens",
              "output_tokens",
              "total_tokens",
              "cost"
            ]
          },
          "additionalProperties": {
            "type": "string",
            "enum": ["harness", "system"]
          }
        }
      },
      "required": ["wall_time_ms", "enforcement"],
      "additionalProperties": false
    },
    "factors": {
      "type": "object",
      "propertyNames": {
        "type": "string",
        "minLength": 1,
        "maxLength": 64,
        "pattern": "^[a-z][a-z0-9_]*$"
      },
      "additionalProperties": {
        "type": ["string", "number", "boolean"]
      }
    },
    "parameters": {
      "type": "object",
      "propertyNames": {
        "type": "string"
      },
      "additionalProperties": {}
    },
    "output_dir": {
      "type": "string",
      "minLength": 1
    }
  },
  "required": [
    "protocol_version",
    "attempt",
    "case",
    "target",
    "budget",
    "factors",
    "parameters",
    "output_dir"
  ],
  "additionalProperties": false,
  "$defs": {
    "TargetProfile": {
      "type": "object",
      "properties": {
        "language": {
          "type": "string",
          "minLength": 1,
          "maxLength": 128,
          "pattern": "^[a-z0-9][a-z0-9._-]*$"
        },
        "build_system": {
          "type": "string",
          "minLength": 1,
          "maxLength": 128,
          "pattern": "^[a-z0-9][a-z0-9._-]*$"
        }
      },
      "required": ["language"],
      "additionalProperties": {}
    },
    "CostLimit": {
      "type": "object",
      "properties": {
        "amount": {
          "type": "number",
          "minimum": 0
        },
        "currency": {
          "type": "string",
          "minLength": 3,
          "maxLength": 3
        }
      },
      "required": ["amount", "currency"],
      "additionalProperties": false
    }
  }
}
